{
  "fileKey" : "FILE123",
  "nodeId" : "1:1",
  "rootNode" : {
    "bounds" : {
      "height" : 844,
      "width" : 390,
      "x" : 0,
      "y" : 0
    },
    "children" : [
      {
        "asset" : {
          "format" : "png",
          "kind" : "image",
          "localPath" : "assets/hero.png",
          "name" : "hero-ref"
        },
        "bounds" : {
          "height" : 180,
          "width" : 342,
          "x" : 24,
          "y" : 32
        },
        "children" : [

        ],
        "confidence" : 0.95,
        "id" : "2:1",
        "name" : "Hero Image",
        "needsReview" : false,
        "type" : "image",
        "warnings" : [

        ]
      },
      {
        "bounds" : {
          "height" : 48,
          "width" : 342,
          "x" : 24,
          "y" : 228
        },
        "children" : [
          {
            "bounds" : {
              "height" : 24,
              "width" : 180,
              "x" : 36,
              "y" : 240
            },
            "children" : [

            ],
            "confidence" : 0.95,
            "id" : "3:1",
            "name" : "Title",
            "needsReview" : false,
            "style" : {
              "text" : {
                "color" : "#12141A",
                "fontFamily" : "Inter",
                "fontSize" : 20,
                "fontWeight" : "600",
                "lineHeight" : 24,
                "textAlign" : "left"
              }
            },
            "text" : "Review order",
            "type" : "text",
            "warnings" : [

            ]
          }
        ],
        "confidence" : 0.95,
        "id" : "2:2",
        "layout" : {
          "mode" : "horizontal",
          "padding" : {
            "bottom" : 8,
            "left" : 12,
            "right" : 12,
            "top" : 8
          },
          "spacing" : 10
        },
        "name" : "Header Row",
        "needsReview" : false,
        "style" : {
          "cornerRadius" : 8,
          "fill" : "#F0F7FF",
          "stroke" : "#CCDBF0",
          "strokeWidth" : 1
        },
        "type" : "frame",
        "warnings" : [

        ]
      }
    ],
    "confidence" : 0.95,
    "id" : "1:1",
    "layout" : {
      "mode" : "vertical",
      "padding" : {
        "bottom" : 32,
        "left" : 24,
        "right" : 24,
        "top" : 32
      },
      "spacing" : 16
    },
    "name" : "Checkout Screen",
    "needsReview" : false,
    "style" : {
      "fill" : "#FFFFFF"
    },
    "type" : "frame",
    "warnings" : [

    ]
  },
  "screenName" : "Checkout Screen",
  "targetPlatform" : "harmony-arkui",
  "tokens" : {
    "colors" : [

    ],
    "radii" : {

    },
    "spacing" : {

    },
    "textStyles" : [

    ]
  },
  "version" : "design-ir/v1",
  "viewport" : {
    "height" : 844,
    "width" : 390
  },
  "warnings" : [

  ]
}
